{
  "schemaVersion": 1,
  "id": "duration-format",
  "profile": "small",
  "workflow": "change",
  "inputs": [
    "brief.md"
  ],
  "createdAt": "2026-09-10T12:56:45.404Z",
  "playbook": {
    "version": "1.1.0",
    "fingerprint": "1493c32ab249cb2fd134f9db7421842509615076c0426dc7809f832502d6eee4"
  },
  "environment": {
    "node": "v26.8.2",
    "platform": "darwin"
  },
  "actors": [
    {
      "agent": "forward-trial-a",
      "model": "unspecified",
      "at": "2026-09-10T12:56:45.422Z"
    },
    {
      "agent": "forward-trial-b",
      "model": "unspecified",
      "at": "2026-09-10T13:04:02.242Z"
    }
  ],
  "limits": {
    "maxAttemptsPerCheck": 3
  },
  "baseline": {
    "revision": null,
    "files": {
      "AGENTS.md": "95531e63ffd9003c11076799e5737b049959f30745d9b9562ae8e08b1e051e42",
      "brief.md": "9aad202cfdbf625c0c3dcdc92deb091f8ad14825fea4920522948a17d71fd03d",
      "src/duration.mjs": "12fcc246f7bc46dd882cacc4514997177291ecb80292cb848199b7cd0d6a6400"
    }
  },
  "receipts": {
    "intake": {
      "fingerprint": "2180054bef324266a47e08f00b1daaa9058bc0a91fea84373f116dc75c8d7417",
      "completedAt": "2026-09-10T12:57:23.571Z",
      "actor": {
        "agent": "forward-trial-a",
        "model": "unspecified",
        "at": "2026-09-10T12:56:45.422Z"
      }
    },
    "requirements": {
      "fingerprint": "09c2671f154a6d0bf5f6bc65522dbfecc66a610cb580acd132a33794c09e4572",
      "completedAt": "2026-09-10T12:58:15.410Z",
      "actor": {
        "agent": "forward-trial-a",
        "model": "unspecified",
        "at": "2026-09-10T12:56:45.422Z"
      }
    },
    "design": {
      "fingerprint": "d7d1fba54fa6c601178dec0a737445e704a3efc920a2c489dbfb4b507430e230",
      "completedAt": "2026-09-10T12:59:11.737Z",
      "actor": {
        "agent": "forward-trial-a",
        "model": "unspecified",
        "at": "2026-09-10T12:56:45.422Z"
      }
    },
    "implementation": {
      "fingerprint": "b6be45ea2498e655fe346a7637e621183d3f88995d9820b1b1ccd9ef4399b773",
      "completedAt": "2026-09-10T13:00:54.726Z",
      "actor": {
        "agent": "forward-trial-a",
        "model": "unspecified",
        "at": "2026-09-10T12:56:45.422Z"
      }
    },
    "verification": {
      "fingerprint": "a11bab43175f0ff4934106f45724c2f65d8acb428c7b2cf27b9a79d958f49341",
      "completedAt": "2026-09-10T13:04:35.083Z",
      "actor": {
        "agent": "forward-trial-b",
        "model": "unspecified",
        "at": "2026-09-10T13:04:02.242Z"
      }
    },
    "readiness": {
      "fingerprint": "0a7ce93d3fd0aea5bc65e06530947c42fc9d53cdfaac43f886f84afd12f84919",
      "completedAt": "2026-09-10T13:04:40.380Z",
      "actor": {
        "agent": "forward-trial-b",
        "model": "unspecified",
        "at": "2026-09-10T13:04:02.242Z"
      }
    }
  },
  "events": [
    {
      "at": "2026-09-10T12:57:23.471Z",
      "actor": {
        "agent": "forward-trial-a",
        "model": "unspecified",
        "at": "2026-09-10T12:56:45.422Z"
      },
      "action": "record",
      "stage": "intake",
      "digest": "57b052e032f278d8547a31e146cb98f3e4c5a56907c5efa58fd1c94ba2561221"
    },
    {
      "at": "2026-09-10T12:57:23.571Z",
      "actor": {
        "agent": "forward-trial-a",
        "model": "unspecified",
        "at": "2026-09-10T12:56:45.422Z"
      },
      "action": "complete",
      "stage": "intake",
      "fingerprint": "2180054bef324266a47e08f00b1daaa9058bc0a91fea84373f116dc75c8d7417"
    },
    {
      "at": "2026-09-10T12:57:55.087Z",
      "actor": {
        "agent": "forward-trial-a",
        "model": "unspecified",
        "at": "2026-09-10T12:56:45.422Z"
      },
      "action": "record",
      "stage": "requirements",
      "digest": "b4981fb47ff648db1d11247981102c2f3db3fd3c3d1fb2b99c4ec5d104135919"
    },
    {
      "at": "2026-09-10T12:58:15.301Z",
      "actor": {
        "agent": "forward-trial-a",
        "model": "unspecified",
        "at": "2026-09-10T12:56:45.422Z"
      },
      "action": "record",
      "stage": "requirements",
      "digest": "7ab24cb0acf6e6b0a58079692beae2112050d29118ec3f26c5b71078a1b70ca2"
    },
    {
      "at": "2026-09-10T12:58:15.410Z",
      "actor": {
        "agent": "forward-trial-a",
        "model": "unspecified",
        "at": "2026-09-10T12:56:45.422Z"
      },
      "action": "complete",
      "stage": "requirements",
      "fingerprint": "09c2671f154a6d0bf5f6bc65522dbfecc66a610cb580acd132a33794c09e4572"
    },
    {
      "at": "2026-09-10T12:59:03.312Z",
      "actor": {
        "agent": "forward-trial-a",
        "model": "unspecified",
        "at": "2026-09-10T12:56:45.422Z"
      },
      "action": "record",
      "stage": "design",
      "digest": "afb74b449aceb1f5fe1cd59b475538b409e0f50bac91595fbb07f49dda8e4bea"
    },
    {
      "at": "2026-09-10T12:59:11.738Z",
      "actor": {
        "agent": "forward-trial-a",
        "model": "unspecified",
        "at": "2026-09-10T12:56:45.422Z"
      },
      "action": "complete",
      "stage": "design",
      "fingerprint": "d7d1fba54fa6c601178dec0a737445e704a3efc920a2c489dbfb4b507430e230"
    },
    {
      "at": "2026-09-10T13:00:54.471Z",
      "actor": {
        "agent": "forward-trial-a",
        "model": "unspecified",
        "at": "2026-09-10T12:56:45.422Z"
      },
      "action": "record",
      "stage": "implementation",
      "digest": "bbd161d09236f6cb16d2ace6207cd4eec3ad1f95ecb95df24c00c8319edd8b04"
    },
    {
      "at": "2026-09-10T13:00:54.726Z",
      "actor": {
        "agent": "forward-trial-a",
        "model": "unspecified",
        "at": "2026-09-10T12:56:45.422Z"
      },
      "action": "complete",
      "stage": "implementation",
      "fingerprint": "b6be45ea2498e655fe346a7637e621183d3f88995d9820b1b1ccd9ef4399b773"
    },
    {
      "at": "2026-09-10T13:01:03.075Z",
      "actor": {
        "agent": "forward-trial-a",
        "model": "unspecified",
        "at": "2026-09-10T12:56:45.422Z"
      },
      "action": "check",
      "check": "CHECK-BEHAVIOR",
      "evidence": "b93f1d69-faeb-4b48-b12d-fa1a21fccf32",
      "result": "pass"
    },
    {
      "at": "2026-09-10T13:04:02.242Z",
      "actor": {
        "agent": "forward-trial-b",
        "model": "unspecified",
        "at": "2026-09-10T13:04:02.242Z"
      },
      "action": "handoff"
    },
    {
      "at": "2026-09-10T13:04:35.083Z",
      "actor": {
        "agent": "forward-trial-b",
        "model": "unspecified",
        "at": "2026-09-10T13:04:02.242Z"
      },
      "action": "complete",
      "stage": "verification",
      "fingerprint": "a11bab43175f0ff4934106f45724c2f65d8acb428c7b2cf27b9a79d958f49341"
    },
    {
      "at": "2026-09-10T13:04:40.380Z",
      "actor": {
        "agent": "forward-trial-b",
        "model": "unspecified",
        "at": "2026-09-10T13:04:02.242Z"
      },
      "action": "complete",
      "stage": "readiness",
      "fingerprint": "0a7ce93d3fd0aea5bc65e06530947c42fc9d53cdfaac43f886f84afd12f84919"
    }
  ]
}
